<?xml version="1.0" encoding="iso-8859-1"?>
<!DOCTYPE SQParams PUBLIC "Z:/Current/TimeSer/SQParams.dtd"
	"http://figis01/DTD/Current/TimeSer/SQParams.dtd">
<SQParams DatasetName="Undecked" ShowUnits="1" ShowFlags="1">
	<Series>POWERED</Series>
	<Series>NOT POWERED</Series>
	<Year>1996</Year>
	<Year>1997</Year>
	<Year>1998</Year>
	<SQKeyParams KeyName="COUNTRY" HierID="10002" Visible="1">
		<DisplayAttr>1:en</DisplayAttr>
	</SQKeyParams>
</SQParams>
