<?xml version="1.0" encoding="iso-8859-1"?>
<!DOCTYPE SQParams PUBLIC "Z:/Current/TimeSer/SQParams.dtd"
	"http://figis01/DTD/Current/TimeSer/SQParams.dtd">
<SQParams DatasetName="Capture" ShowUnits="1" ShowFlags="1">
	<Series>QUANTITY</Series>
	

	<SQKeyParams KeyName="COUNTRY" MetaID="13001" HierID="0" Visible="1">
		<DisplayAttr>1:en</DisplayAttr> 
		<DisplayAttr>1:fr</DisplayAttr> 
		<DisplayAttr>1:es</DisplayAttr> 
		<DisplayAttr>23</DisplayAttr> 
		<Selection><ID>106</ID></Selection>
	</SQKeyParams>
			
	<SQKeyParams KeyName="SPECIES" HierID="30002" Visible="1">
		<DisplayAttr>12</DisplayAttr> 
		<DisplayAttr>1:en</DisplayAttr> 
		<DisplayAttr>1:fr</DisplayAttr> 
		<DisplayAttr>1:es</DisplayAttr> 
		<DisplayAttr>13</DisplayAttr> 
		<DisplayAttr>11</DisplayAttr> 
		
<Selection>
			<ID>1401</ID>	
			<ID>1402</ID>	
			<ID>1403</ID>	
			<ID>1404</ID>	
			<ID>1405</ID>	
			<ID>1406</ID>	
			<ID>1407</ID>	
			<ID>1408</ID>	
			<ID>1409</ID>	
			<ID>1410</ID>	
			<ID>1411</ID>	
			<ID>1412</ID>	
			<ID>1413</ID>	
			<ID>1414</ID>	
			<ID>1415</ID>	
			<ID>1416</ID>	
			<ID>1417</ID>	
			<ID>1418</ID>	
			<ID>1419</ID>	
			<ID>1420</ID>	
			<ID>1421</ID>	
			<ID>1422</ID>	
			<ID>1423</ID>	
			<ID>1424</ID>	
			<ID>1425</ID>	
			<ID>1426</ID>	
			<ID>1427</ID>	
			<ID>1428</ID>	
			<ID>1429</ID>	
			<ID>1430</ID>	
			<ID>1431</ID>	
			<ID>1432</ID>	
			<ID>1437</ID>	
			<ID>1438</ID>	
			<ID>1440</ID>	
			<ID>1441</ID>	
			<ID>1442</ID>	
			<ID>1443</ID>	
<Query>http://figis01:8080/figis/servlet/RefObjectServlet?meta=31101&amp;cmd=related&amp;rel=32001&amp;related=1401</Query>
<Query>http://figis01:8080/figis/servlet/RefObjectServlet?meta=31101&amp;cmd=related&amp;rel=32001&amp;related=1402</Query>
<Query>http://figis01:8080/figis/servlet/RefObjectServlet?meta=31101&amp;cmd=related&amp;rel=32001&amp;related=1403</Query>
<Query>http://figis01:8080/figis/servlet/RefObjectServlet?meta=31101&amp;cmd=related&amp;rel=32001&amp;related=1404</Query>
<Query>http://figis01:8080/figis/servlet/RefObjectServlet?meta=31101&amp;cmd=related&amp;rel=32001&amp;related=1405</Query>
<Query>http://figis01:8080/figis/servlet/RefObjectServlet?meta=31101&amp;cmd=related&amp;rel=32001&amp;related=1406</Query>
<Query>http://figis01:8080/figis/servlet/RefObjectServlet?meta=31101&amp;cmd=related&amp;rel=32001&amp;related=1407</Query>
<Query>http://figis01:8080/figis/servlet/RefObjectServlet?meta=31101&amp;cmd=related&amp;rel=32001&amp;related=1408</Query>
<Query>http://figis01:8080/figis/servlet/RefObjectServlet?meta=31101&amp;cmd=related&amp;rel=32001&amp;related=1409</Query>
<Query>http://figis01:8080/figis/servlet/RefObjectServlet?meta=31101&amp;cmd=related&amp;rel=32001&amp;related=1410</Query>
<Query>http://figis01:8080/figis/servlet/RefObjectServlet?meta=31101&amp;cmd=related&amp;rel=32001&amp;related=1411</Query>
<Query>http://figis01:8080/figis/servlet/RefObjectServlet?meta=31101&amp;cmd=related&amp;rel=32001&amp;related=1412</Query>
<Query>http://figis01:8080/figis/servlet/RefObjectServlet?meta=31101&amp;cmd=related&amp;rel=32001&amp;related=1413</Query>
<Query>http://figis01:8080/figis/servlet/RefObjectServlet?meta=31101&amp;cmd=related&amp;rel=32001&amp;related=1414</Query>
<Query>http://figis01:8080/figis/servlet/RefObjectServlet?meta=31101&amp;cmd=related&amp;rel=32001&amp;related=1415</Query>
<Query>http://figis01:8080/figis/servlet/RefObjectServlet?meta=31101&amp;cmd=related&amp;rel=32001&amp;related=1416</Query>
<Query>http://figis01:8080/figis/servlet/RefObjectServlet?meta=31101&amp;cmd=related&amp;rel=32001&amp;related=1417</Query>
<Query>http://figis01:8080/figis/servlet/RefObjectServlet?meta=31101&amp;cmd=related&amp;rel=32001&amp;related=1418</Query>
<Query>http://figis01:8080/figis/servlet/RefObjectServlet?meta=31101&amp;cmd=related&amp;rel=32001&amp;related=1419</Query>
<Query>http://figis01:8080/figis/servlet/RefObjectServlet?meta=31101&amp;cmd=related&amp;rel=32001&amp;related=1420</Query>
<Query>http://figis01:8080/figis/servlet/RefObjectServlet?meta=31101&amp;cmd=related&amp;rel=32001&amp;related=1421</Query>
<Query>http://figis01:8080/figis/servlet/RefObjectServlet?meta=31101&amp;cmd=related&amp;rel=32001&amp;related=1422</Query>
<Query>http://figis01:8080/figis/servlet/RefObjectServlet?meta=31101&amp;cmd=related&amp;rel=32001&amp;related=1423</Query>
<Query>http://figis01:8080/figis/servlet/RefObjectServlet?meta=31101&amp;cmd=related&amp;rel=32001&amp;related=1424</Query>
<Query>http://figis01:8080/figis/servlet/RefObjectServlet?meta=31101&amp;cmd=related&amp;rel=32001&amp;related=1425</Query>
<Query>http://figis01:8080/figis/servlet/RefObjectServlet?meta=31101&amp;cmd=related&amp;rel=32001&amp;related=1426</Query>
<Query>http://figis01:8080/figis/servlet/RefObjectServlet?meta=31101&amp;cmd=related&amp;rel=32001&amp;related=1427</Query>
<Query>http://figis01:8080/figis/servlet/RefObjectServlet?meta=31101&amp;cmd=related&amp;rel=32001&amp;related=1428</Query>
<Query>http://figis01:8080/figis/servlet/RefObjectServlet?meta=31101&amp;cmd=related&amp;rel=32001&amp;related=1429</Query>
<Query>http://figis01:8080/figis/servlet/RefObjectServlet?meta=31101&amp;cmd=related&amp;rel=32001&amp;related=1430</Query>
<Query>http://figis01:8080/figis/servlet/RefObjectServlet?meta=31101&amp;cmd=related&amp;rel=32001&amp;related=1431</Query>
<Query>http://figis01:8080/figis/servlet/RefObjectServlet?meta=31101&amp;cmd=related&amp;rel=32001&amp;related=1432</Query>
<Query>http://figis01:8080/figis/servlet/RefObjectServlet?meta=31101&amp;cmd=related&amp;rel=32001&amp;related=1437</Query>
<Query>http://figis01:8080/figis/servlet/RefObjectServlet?meta=31101&amp;cmd=related&amp;rel=32001&amp;related=1438</Query>
<Query>http://figis01:8080/figis/servlet/RefObjectServlet?meta=31101&amp;cmd=related&amp;rel=32001&amp;related=1440</Query>
<Query>http://figis01:8080/figis/servlet/RefObjectServlet?meta=31101&amp;cmd=related&amp;rel=32001&amp;related=1441</Query>
<Query>http://figis01:8080/figis/servlet/RefObjectServlet?meta=31101&amp;cmd=related&amp;rel=32001&amp;related=1442</Query>
<Query>http://figis01:8080/figis/servlet/RefObjectServlet?meta=31101&amp;cmd=related&amp;rel=32001&amp;related=1443</Query>
		</Selection>
	</SQKeyParams>


	<SQKeyParams KeyName="OCEAN_AREA" MetaID="22010" HierID="0" Visible="1">
		 <DisplayAttr>21</DisplayAttr> 
	</SQKeyParams>


</SQParams>
