<?xml version="1.0" encoding="iso-8859-1"?>
<!DOCTYPE SQParams PUBLIC "Z:/Current/TimeSer/SQParams.dtd"
	"http://figis01/DTD/Current/TimeSer/SQParams.dtd">

<SQParams DatasetName="Capture" ShowUnits="1" ShowFlags="1">
<Series>QUANTITY</Series>

<SQKeyParams KeyName="OCEAN_AREA" MetaID="22010" HierID="0" Visible="1">
 <DisplayAttr>21</DisplayAttr> 
</SQKeyParams>



<SQKeyParams KeyName="SPECIES" HierID="0" Visible="1">
<DisplayAttr>11</DisplayAttr>
<DisplayAttr>13</DisplayAttr>
<DisplayAttr>12</DisplayAttr>
  &ThreeNames;

</SQKeyParams>

<SQKeyParams KeyName="COUNTRY" HierID="0" Visible="1">
<DisplayAttr>1:en</DisplayAttr>
<Selection>
<ID>106</ID>
</Selection>

</SQKeyParams>

&YearBookYears;
</SQParams>