<?xml version="1.0" encoding="iso-8859-1"?>
<!DOCTYPE SQParams PUBLIC "Z:/Current/TimeSer/SQParams.dtd"
	"http://figis01/DTD/Current/TimeSer/SQParams.dtd">
<SQParams DatasetName="Capture" ShowUnits="1" ShowFlags="1">
	<Series>QUANTITY</Series>
	

	<SQKeyParams KeyName="COUNTRY" MetaID="13001" HierID="0" Visible="1">
		<DisplayAttr>1:en</DisplayAttr> 
		<DisplayAttr>1:fr</DisplayAttr> 
		<DisplayAttr>1:es</DisplayAttr> 
		<DisplayAttr>23</DisplayAttr> 

	</SQKeyParams>
			
	<SQKeyParams KeyName="SPECIES" HierID="30002" Visible="1">
		<DisplayAttr>12</DisplayAttr> 
		<DisplayAttr>1:en</DisplayAttr> 
		<DisplayAttr>1:fr</DisplayAttr> 
		<DisplayAttr>1:es</DisplayAttr> 
		<DisplayAttr>13</DisplayAttr> 
		<DisplayAttr>11</DisplayAttr> 
		
		<Selection>
			<ID>1433</ID>	
			<ID>1434</ID>	
			<ID>1435</ID>	
			<ID>1436</ID>	
		</Selection>
	</SQKeyParams>

	<SQKeyParams KeyName="SPECIES" MetaID="0" HierID="0" Visible="1">
		<DisplayAttr>12</DisplayAttr> 
		<DisplayAttr>1:en</DisplayAttr> 
		<DisplayAttr>1:fr</DisplayAttr> 
		<DisplayAttr>1:es</DisplayAttr> 
		<DisplayAttr>13</DisplayAttr> 
		<DisplayAttr>11</DisplayAttr> 
	</SQKeyParams>

	<SQKeyParams KeyName="OCEAN_AREA" MetaID="22010" HierID="0" Visible="1">
		 <DisplayAttr>21</DisplayAttr> 
	</SQKeyParams>


</SQParams>
